{
  "schema_version": 1,
  "toolkit_version": "5.0.0",
  "provenance": {
    "origin": "repository-maintained",
    "license": "MIT",
    "maintainer": {
      "name": "Felipe Maurício da Silva",
      "email": "fellipemauriciosilva@gmail.com",
      "linkedin": "https://www.linkedin.com/in/felipe-mauricio-06685735/"
    },
    "review_status": "pending-release-review"
  },
  "runtimes": {
    "claude": {
      "renderer": "markdown",
      "count": 17,
      "files": [
        {
          "path": "dist/claude/sdd-analyze-demand.md",
          "sha256": "5771463478eca8387e2facf6a7e2aacae4cb9295e1fe958a5f97e82825bc0370"
        },
        {
          "path": "dist/claude/sdd-analyze-migration.md",
          "sha256": "dac05bacd39affab24995d755af1e256be53d6b801782f4bc166555d5db1e84a"
        },
        {
          "path": "dist/claude/sdd-architect.md",
          "sha256": "d99c8342ce0e37c11055a0d04e98b31a670bf29c7a79aa47e72f6d8610cab020"
        },
        {
          "path": "dist/claude/sdd-create-spec.md",
          "sha256": "f6cbba65a0b0941b1f7367c257fc18e0f7c60e62a9b5de7d29dda0d9fc59f918"
        },
        {
          "path": "dist/claude/sdd-generate-e2e-tests.md",
          "sha256": "174ab5c76b5a91d062e446f12c9f0d7d0f62fdf4e26c6e050d8a20c695c149fa"
        },
        {
          "path": "dist/claude/sdd-generate-integration-tests.md",
          "sha256": "da3ff084c6ebb79651cc3fe5ff9f7e668019ce35567864715b19ee707d4a49e3"
        },
        {
          "path": "dist/claude/sdd-generate-tests.md",
          "sha256": "132197bb08f4d050590ae85e36f5bc324844bfa33cf23408899e8a5db23dc88d"
        },
        {
          "path": "dist/claude/sdd-implement-spec.md",
          "sha256": "71e143750ea9164a0b83d8e57115ca4c207a4512cf24efa37871464393a0c1b1"
        },
        {
          "path": "dist/claude/sdd-install-sdd-kit.md",
          "sha256": "7a143c5038b5e10d1ff112cf38b910fa1caebe25d409f1e2941f93b188ae7e73"
        },
        {
          "path": "dist/claude/sdd-investigate-bug.md",
          "sha256": "9bbeb75039a02498eada14da3fecdebbbd47f21cbca25a7e859dad9d091c08bd"
        },
        {
          "path": "dist/claude/sdd-orchestrator.md",
          "sha256": "e8c933d371c83181c104a42a7dbee871dda5e3f26bfe5c315f80c5fd7eb4ef4a"
        },
        {
          "path": "dist/claude/sdd-read-document.md",
          "sha256": "43ff73d313fc88c710ab81f7fdd453afbc1e9a0f13a0c4e816e5cee9375490b9"
        },
        {
          "path": "dist/claude/sdd-refactor-code.md",
          "sha256": "58a5d02ff82a6c4cea8df2f64f0a6b2ad3d3cf4a51deea5d35805b41cf06084f"
        },
        {
          "path": "dist/claude/sdd-review-code.md",
          "sha256": "20abe5fc73ca84e51cb2494117da4c740ff7c2554e6e8ef0acd971ac3944da73"
        },
        {
          "path": "dist/claude/sdd-setup-project.md",
          "sha256": "fadbb90551ee100ccb852f97db449d365438bcb3b09a2f2d852a9d84e7a519c9"
        },
        {
          "path": "dist/claude/sdd-update-documentation.md",
          "sha256": "6310bee5a6b84ef4355115307753530195506038623c1d6cc5ab0d61286dc09c"
        },
        {
          "path": "dist/claude/sdd-workspace-sync.md",
          "sha256": "32b40300721263fa1a28bf9de2d6c439e16e017f17217899cfc63c28d7eca248"
        }
      ]
    },
    "codex": {
      "renderer": "codex-toml",
      "count": 17,
      "files": [
        {
          "path": "dist/codex/sdd-analyze-demand.toml",
          "sha256": "9b68f21a559d411a578f4187b7b1213365932176217b47294b4709ff504e1c5f"
        },
        {
          "path": "dist/codex/sdd-analyze-migration.toml",
          "sha256": "e8c2f1cc98bfb3bdadf010a38c2c9e80b38892463624000c98a17068afa72014"
        },
        {
          "path": "dist/codex/sdd-architect.toml",
          "sha256": "9fc305d9be6dd6c288de83df8c03e418bf5c1494def841e62d1834572d6ed9f7"
        },
        {
          "path": "dist/codex/sdd-create-spec.toml",
          "sha256": "cf41e2348858b4823f086719ec5c09e4e57dde57390bb571278511c4b84fd839"
        },
        {
          "path": "dist/codex/sdd-generate-e2e-tests.toml",
          "sha256": "d5f61eb377c89cfb8b0b4d60d33d4bacbbaf0d9474bf7a0be1e8a61e4ea0339c"
        },
        {
          "path": "dist/codex/sdd-generate-integration-tests.toml",
          "sha256": "bea12fe4e1f868a0eb5b82414f61bedb1c9739dddfd5db174277093a358ba6c7"
        },
        {
          "path": "dist/codex/sdd-generate-tests.toml",
          "sha256": "7d52ab22364fabda6734b43fb47b0a8e7118bd63d39768e78d20f5dc73eb104d"
        },
        {
          "path": "dist/codex/sdd-implement-spec.toml",
          "sha256": "f3dfb951a7a6d566d066c34e182430ff99c8acd6145645d03426f1b993663bdf"
        },
        {
          "path": "dist/codex/sdd-install-sdd-kit.toml",
          "sha256": "d48f2eeabb1cdfc0f2fabea6527fefabc18712096aa0a95c2eb0934fd7555512"
        },
        {
          "path": "dist/codex/sdd-investigate-bug.toml",
          "sha256": "eb0e0ac9bb94ef354747cfad13f41410ac774e4839a11f1d771a8255c122b2c2"
        },
        {
          "path": "dist/codex/sdd-orchestrator.toml",
          "sha256": "b6231df7d3ceb48d08920a164e9fb5ecf75ee9e119cc901a7eb2d0d6f7ac8b88"
        },
        {
          "path": "dist/codex/sdd-read-document.toml",
          "sha256": "ace22be48e48480a150480520fd3e5016be154d2183645893f9ae9af3ac3e564"
        },
        {
          "path": "dist/codex/sdd-refactor-code.toml",
          "sha256": "83f238f102ad1ad663d21d4a0d53bca0a3c863a63316a8d18950d01e12342edc"
        },
        {
          "path": "dist/codex/sdd-review-code.toml",
          "sha256": "2101c663fd616f4d851c3c4d48b2c0547a12821af1bfb92d2da4d8cdc5fa7b5a"
        },
        {
          "path": "dist/codex/sdd-setup-project.toml",
          "sha256": "49faf6067d37fbca4a0cdd72b68c7a37eb708e421fc58bcb0c94d324960a8f61"
        },
        {
          "path": "dist/codex/sdd-update-documentation.toml",
          "sha256": "0c749757a502da99c686851febc2d22f19cfa64665b45b7740bd1c3f71f58f58"
        },
        {
          "path": "dist/codex/sdd-workspace-sync.toml",
          "sha256": "c291b29f7cdde3022beedd95082a346fe42f2e1e7685c6f4947929368e1d68ff"
        }
      ]
    },
    "copilot": {
      "renderer": "markdown",
      "count": 17,
      "files": [
        {
          "path": "dist/copilot/sdd-analyze-demand.agent.md",
          "sha256": "185ebc816e45a87ee7662bacce9c85dfcd7f843dcb30c4f39060fd4d21dce1c7"
        },
        {
          "path": "dist/copilot/sdd-analyze-migration.agent.md",
          "sha256": "622f5892129df503cebdac126b21d3d29bd6c771efed4047bea4bc7432edad37"
        },
        {
          "path": "dist/copilot/sdd-architect.agent.md",
          "sha256": "4373c34afe6b5450d444de778504ad049f685be11245379fda177a45222a162a"
        },
        {
          "path": "dist/copilot/sdd-create-spec.agent.md",
          "sha256": "e7f9df45534b42ad42b75968423297bae4b0730ec31858ba5e66c7cbd0015e25"
        },
        {
          "path": "dist/copilot/sdd-generate-e2e-tests.agent.md",
          "sha256": "99b36b4690b20fa39c34e3a7e14c1a7e3c459be147987ab3b73019b13cf8ecc2"
        },
        {
          "path": "dist/copilot/sdd-generate-integration-tests.agent.md",
          "sha256": "a325086bdeb55d452970a66c3e2c088a20543d87cd8b9bd992a9bdd4ce8e0c3c"
        },
        {
          "path": "dist/copilot/sdd-generate-tests.agent.md",
          "sha256": "cd561801d8a310be8b33c73386ae6ad3b956976a2bffe084ab4dde98cbd570b1"
        },
        {
          "path": "dist/copilot/sdd-implement-spec.agent.md",
          "sha256": "c399d0b049fc2b21a0b2be41d6ec5c22d3bb53425355fb5c0479e719dc821af9"
        },
        {
          "path": "dist/copilot/sdd-install-sdd-kit.agent.md",
          "sha256": "07ac239a491e6020a6ffda6dba246e0b768d4c3fcc389954e2baecacae42fe54"
        },
        {
          "path": "dist/copilot/sdd-investigate-bug.agent.md",
          "sha256": "e638bc828d8ced0834d5219c5c90dd36ae0875a172bfcea40cac29161632c8d8"
        },
        {
          "path": "dist/copilot/sdd-orchestrator.agent.md",
          "sha256": "1de006f1cdef7c5076dae8b99fc2e6cdd3398b6316c91c274736bed34acaa350"
        },
        {
          "path": "dist/copilot/sdd-read-document.agent.md",
          "sha256": "acfb1c5d180c6d87f6bf9bcb509a9a955b1ec75d9a412eb04224b7a6c163188a"
        },
        {
          "path": "dist/copilot/sdd-refactor-code.agent.md",
          "sha256": "10fb202f98ba9a52354b4d2043ffb3d6c9da54c88bfaf739c940150ac0209f4e"
        },
        {
          "path": "dist/copilot/sdd-review-code.agent.md",
          "sha256": "de0b0def4891761ce4814886ab834d55e1119509375ad49c14db5dd30e92cad1"
        },
        {
          "path": "dist/copilot/sdd-setup-project.agent.md",
          "sha256": "2613679df989ff35c362915f3e35e638e7fed243da4a68e4a2be66ad33928c6f"
        },
        {
          "path": "dist/copilot/sdd-update-documentation.agent.md",
          "sha256": "a8e2779e34faceca86655f3cdd9ee4205c9a3c89abc07d0073035aa2aefe5776"
        },
        {
          "path": "dist/copilot/sdd-workspace-sync.agent.md",
          "sha256": "83ef1ee57dd8e09d6d6d66d1e01777b613b5e567c93b0488388bb83bed8a5b10"
        }
      ]
    },
    "cursor": {
      "renderer": "cursor-markdown",
      "count": 17,
      "files": [
        {
          "path": "dist/cursor/sdd-analyze-demand.md",
          "sha256": "8629d58488eef24e23badace20e70a821270700343ff66ece7119478a9ccacf9"
        },
        {
          "path": "dist/cursor/sdd-analyze-migration.md",
          "sha256": "a6cf781d772ba85dda99a27228aecf237aa14c2e8bf98c023fdeacfafeab0a77"
        },
        {
          "path": "dist/cursor/sdd-architect.md",
          "sha256": "ee3700f79e348079a282c4382f12ef5eaac4e79d74045e3be74df00a0acdcb8c"
        },
        {
          "path": "dist/cursor/sdd-create-spec.md",
          "sha256": "00b00fef52052f606b5172cf52c87406628139c6bc56fc5edda24a18193770f1"
        },
        {
          "path": "dist/cursor/sdd-generate-e2e-tests.md",